ID,Type,SKU,Name,Published,"Is featured?","Visibility in catalog","Short description",Description,"Date sale price starts","Date sale price ends","Tax status","Tax class","In stock?",Stock,"Low stock amount","Backorders allowed?","Sold individually?","Weight (lbs)","Length (in)","Width (in)","Height (in)","Allow customer reviews?","Purchase note","Sale price","Regular price",Categories,Tags,"Shipping class",Images,"Download limit","Download expiry days",Parent,"Grouped products",Upsells,Cross-sells,"External URL","Button text",Position,"Tiered pricing type","Tiered pricing minimum product quantity","Fixed Tiered Prices","Percentage Tiered Prices",Brand,"Attribute 1 name","Attribute 1 value(s)","Attribute 1 visible","Attribute 1 global","Attribute 2 name","Attribute 2 value(s)","Attribute 2 visible","Attribute 2 global","Attribute 3 name","Attribute 3 value(s)","Attribute 3 visible","Attribute 3 global","Attribute 4 name","Attribute 4 value(s)","Attribute 4 visible","Attribute 4 global","Attribute 5 name","Attribute 5 value(s)","Attribute 5 visible","Attribute 5 global","Attribute 6 name","Attribute 6 value(s)","Attribute 6 visible","Attribute 6 global","Attribute 7 name","Attribute 7 value(s)","Attribute 7 visible","Attribute 7 global","Attribute 8 name","Attribute 8 value(s)","Attribute 8 visible","Attribute 8 global","Attribute 9 name","Attribute 9 value(s)","Attribute 9 visible","Attribute 9 global","Attribute 10 name","Attribute 10 value(s)","Attribute 10 visible","Attribute 10 global","Attribute 11 name","Attribute 11 value(s)","Attribute 11 visible","Attribute 11 global","Attribute 12 name","Attribute 12 value(s)","Attribute 12 visible","Attribute 12 global","Attribute 13 name","Attribute 13 value(s)","Attribute 13 visible","Attribute 13 global","Attribute 14 name","Attribute 14 value(s)","Attribute 14 visible","Attribute 14 global","Attribute 15 name","Attribute 15 value(s)","Attribute 15 visible","Attribute 15 global","Attribute 16 name","Attribute 16 value(s)","Attribute 16 visible","Attribute 16 global"
,simple,"AXPG-6-G1  2-OZ/KIT","AXPG-6-G1  2-OZ/KIT",1,0,visible,"TOUCH UP KIT H/S TOP COAT H/G GRAY BAC 707 (5 min.)\n\n\n<strong><i>QPL:</i></strong> BAMS 565-009 TYPE I, CLASS A, GRADE B; BMS 10-60, TYPE II, CLASS B, GRADE D; BMS 10-72R, TYPE VI; CMS 565-09, TYPE II CLASS A GRADE B; DMS 2112, COMP C; MIL-C-83286; MIL-C-85285\n\n\n<strong><i>Meets the requirements of:</i></strong> AIMS 04-04-013; BMS 10-60, TYPE I &amp; II, CLASS B, GRADE D; BMS 10-72; DMS 2143, COMP C; MIL-PRF-85285, TYPE I, CLASS H\n\n\n<strong><i>Color specs:</i></strong> BAC  707  GRAY","This High Solids Polyurethane topcoat series, with low VOC, is designed for use on aircraft and other equipment requiring chemical resistance and color retention. When fully cured these coatings exhibit skydrol and mar resistance and meet the most demanding aerospace specifications for chemical resistance, hardness, flexibility, color and gloss retention.\n\n\n<strong><i>QPL:</i></strong> BAMS 565-009 TYPE I, CLASS A, GRADE B; BMS 10-60, TYPE II, CLASS B, GRADE D; BMS 10-72R, TYPE VI; CMS 565-09, TYPE II CLASS A GRADE B; DMS 2112, COMP C; MIL-C-83286; MIL-C-85285\n\n\n<strong><i>Meets the requirements of:</i></strong> AIMS 04-04-013; BMS 10-60, TYPE I &amp;amp; II, CLASS B, GRADE D; BMS 10-72; DMS 2143, COMP C; MIL-PRF-85285, TYPE I, CLASS H\n\n\n<strong><i>Color specs:</i></strong> BAC  707  GRAY<p><b><i>Notice:</i></b> This is a made-to-order product and has a lead time of 3 business days before it can be shiped.</p><hr />",,,taxable,,1,111,,0,0,0.50,8.00,8.00,8.00,0,,,25.43,"PAINTS > COM-TOUCH UP KITS",,,https://jdlindustries.com/wp-content/uploads/hentzen-2oz-1024.jpg,,,,,,,,,0,fixed,1,"5:25.43,25:20.34,50:16.27,100:13.00",,,Color,GRAY,1,1,Weight,0.50,1,1,Manufacturer,HENTZEN,1,1,"Unit of Measure",EA,1,1,UPC,,1,1,Barcode1,PG6G1,1,1,Barcode2,,1,1,"Vendor SKU",PG-6-G1,1,1,Aviation,Yes,1,1,Marine,No,1,1,Industrial,No,1,1,Hazardous,No,1,1,Special packaging,No,1,1,Ship frozen,No,1,1,Family,TOPCOAT,1,1,Lead time,3 business days,1,1,,,,
,simple,"AXPG-6-G1  G2","AXPG-6-G1  G2",1,0,visible,"H/SOLIDS TOPCOAT - GLOSS GRAY BAC-707 2GL KIT\n\n\n<strong><i>QPL:</i></strong> BAMS 565-009 TYPE I, CLASS A, GRADE B; BMS 10-60, TYPE II, CLASS B, GRADE D; BMS 10-72R, TYPE VI; CMS 565-09, TYPE II CLASS A GRADE B; DMS 2112, COMP C; MIL-C-83286; MIL-C-85285\n\n\n<strong><i>Meets the requirements of:</i></strong> AIMS 04-04-013; BMS 10-60, TYPE I &amp; II, CLASS B, GRADE D; BMS 10-72; DMS 2143, COMP C; MIL-PRF-85285, TYPE I, CLASS H\n\n\n<strong><i>Color specs:</i></strong> BAC 707 GRAY","This High Solids Polyurethane topcoat series, with low VOC, is designed for use on aircraft and other equipment requiring chemical resistance and color retention. When fully cured these coatings exhibit skydrol and mar resistance and meet the most demanding aerospace specifications for chemical resistance, hardness, flexibility, color and gloss retention.\n\n\n<strong><i>QPL:</i></strong> BAMS 565-009 TYPE I, CLASS A, GRADE B; BMS 10-60, TYPE II, CLASS B, GRADE D; BMS 10-72R, TYPE VI; CMS 565-09, TYPE II CLASS A GRADE B; DMS 2112, COMP C; MIL-C-83286; MIL-C-85285\n\n\n<strong><i>Meets the requirements of:</i></strong> AIMS 04-04-013; BMS 10-60, TYPE I &amp;amp; II, CLASS B, GRADE D; BMS 10-72; DMS 2143, COMP C; MIL-PRF-85285, TYPE I, CLASS H\n\n\n<strong><i>Color specs:</i></strong> BAC 707 GRAY<p><b><i>Notice:</i></b> This is a made-to-order product and has a lead time of 3 business days before it can be shiped.</p><hr />",,,taxable,,1,5,,0,0,23.00,8.00,14.00,9.00,0,,,463.40,"PAINTS > EXTERIOR",,,https://jdlindustries.com/wp-content/uploads/hentzen-pg-gal-1024.jpg,,,,,,,,,0,fixed,1,"1:308.75,9:249.25,49:211.25",,,Color,GRAY,1,1,Weight,23.00,1,1,Manufacturer,HENTZEN,1,1,"Unit of Measure",GALKIT,1,1,UPC,,1,1,Barcode1,,1,1,Barcode2,,1,1,"Vendor SKU","PG-6-G1, PG6G1",1,1,Aviation,Yes,1,1,Marine,No,1,1,Industrial,No,1,1,Hazardous,No,1,1,Special packaging,No,1,1,Ship frozen,No,1,1,Family,TOPCOAT,1,1,Lead time,3 business days,1,1,,,,
,simple,"AXPG-6-G1 Q2","AXPG-6-G1 Q2",1,0,visible,"H-SOLIDS TOPCOAT ""GLOSS GRAY BAC 707"" BMS 1060 TYII\n\n\n<strong><i>QPL:</i></strong> BAMS 565-009 TYPE I, CLASS A, GRADE B; BMS 10-60, TYPE II, CLASS B, GRADE D; BMS 10-72R, TYPE VI; CMS 565-09, TYPE II CLASS A GRADE B; DMS 2112, COMP C; MIL-C-83286; MIL-C-85285\n\n\n<strong><i>Meets the requirements of:</i></strong> AIMS 04-04-013; BMS 10-60, TYPE I &amp; II, CLASS B, GRADE D; BMS 10-72; DMS 2143, COMP C; MIL-PRF-85285, TYPE I, CLASS H\n\n\n<strong><i>Color specs:</i></strong> BAC 707 GRAY","This High Solids Polyurethane topcoat series, with low VOC, is designed for use on aircraft and other equipment requiring chemical resistance and color retention. When fully cured these coatings exhibit skydrol and mar resistance and meet the most demanding aerospace specifications for chemical resistance, hardness, flexibility, color and gloss retention.\n\n\n<strong><i>QPL:</i></strong> BAMS 565-009 TYPE I, CLASS A, GRADE B; BMS 10-60, TYPE II, CLASS B, GRADE D; BMS 10-72R, TYPE VI; CMS 565-09, TYPE II CLASS A GRADE B; DMS 2112, COMP C; MIL-C-83286; MIL-C-85285\n\n\n<strong><i>Meets the requirements of:</i></strong> AIMS 04-04-013; BMS 10-60, TYPE I &amp;amp; II, CLASS B, GRADE D; BMS 10-72; DMS 2143, COMP C; MIL-PRF-85285, TYPE I, CLASS H\n\n\n<strong><i>Color specs:</i></strong> BAC 707 GRAY<p><b><i>Notice:</i></b> This is a made-to-order product and has a lead time of 3 business days before it can be shiped.</p><hr />",,,taxable,,1,1,,0,0,6.00,8.00,14.00,9.00,0,,,215.00,"PAINTS > EXTERIOR",,,https://jdlindustries.com/wp-content/uploads/hentzen-qrt-1024.jpg,,,,,,,,,0,fixed,1,"1:131.50,9:100.25,33:86.00",,,Color,GRAY,1,1,Weight,6.00,1,1,Manufacturer,HENTZEN,1,1,"Unit of Measure",QRT,1,1,UPC,,1,1,Barcode1,,1,1,Barcode2,,1,1,"Vendor SKU",PG-6-G1,1,1,Aviation,Yes,1,1,Marine,Yes,1,1,Industrial,Yes,1,1,Hazardous,No,1,1,Special packaging,No,1,1,Ship frozen,No,1,1,Family,TOPCOAT,1,1,Lead time,3 business days,1,1,,,,
,simple,HZ08609TUZ-ULVOC-G1,HZ08609TUZ-ULVOC-G1,1,0,visible,"MIL-DLT-53039 TYPE 4 FCS 33446 TAN686A\n\n\n<strong><i>QPL:</i></strong> MIL-DTL-53039 TYPE IV\n\n\n<strong><i>Color specs:</i></strong> TAN FCS# 33446","MIL-DTL-539039E TYPE 1V 1,0 VOC VOHAPS FREE ZENTHANE SILICA FREE POLYMERIC BEAD FLATTENED SINGLE COMPONENT ALIPHATIC POLYURETHANE COATING CHEMICAL AGENT RESISTANT CARC\n\n\n<strong><i>QPL:</i></strong> MIL-DTL-53039 TYPE IV\n\n\n<strong><i>Color specs:</i></strong> TAN FCS# 33446<p><b><i>Notice:</i></b> This is a made-to-order product and has a lead time of 30 business days before it can be shiped.</p><hr />",,,taxable,,1,100,,0,0,23.00,9.00,15.00,9.00,0,,,355.00,"PAINTS > MIL-CARC",,,https://jdlindustries.com/wp-content/uploads/hentzen-mil-gallon-1024.jpg,,,,,,,,,0,fixed,1,"1:355.00,5:328.60,10:304.25",,,Color,,1,1,Weight,23.00,1,1,Manufacturer,HENTZEN,1,1,"Unit of Measure",GALKIT,1,1,UPC,,1,1,Barcode1,"NSN  8010-01-582-728",1,1,Barcode2,,1,1,"Vendor SKU",08609TUZ-UVLOC-G1,1,1,Aviation,Yes,1,1,Marine,No,1,1,Industrial,No,1,1,Hazardous,Yes,1,1,Special packaging,Yes,1,1,Ship frozen,No,1,1,Family,,1,1,Lead time,30 business days,1,1,,,,
,simple,HZ08610KUZ-UVLOC-G1,HZ08610KUZ-UVLOC-G1,1,0,visible,"MIL-DTL-53039 TTYPE 4   FCS 37030\n\n\n<strong><i>QPL:</i></strong> MIL-DTL-53039 TYPE IX","MIL-DTL-53039 TYPE 1V  \n1.0 VOC VOHAPS FREE ZENTHANE SILICA FREE POLYMERIC BEAD FLATTENED SINGLE COMPONENT ALIPHATIC COATING CHEMICAL AGENT RESISTANT CARC NSN NUMBER 8010-01-582-7301 \n\n\n<strong><i>QPL:</i></strong> MIL-DTL-53039 TYPE IX<p><b><i>Notice:</i></b> This is a made-to-order product and has a lead time of 45 business days before it can be shiped.</p><hr />",,,taxable,,1,100,,0,0,23.00,9.00,15.00,9.00,0,,,345.95,"PAINTS > MIL-CARC",,,https://jdlindustries.com/wp-content/uploads/hentzen-mil-gallon-1024.jpg,,,,,,,,,0,fixed,1,"1:349.95,5:321.25,10:296.50",,,Color,,1,1,Weight,23.00,1,1,Manufacturer,HENTZEN,1,1,"Unit of Measure",GAL,1,1,UPC,,1,1,Barcode1,"NSN 8010-582-7301",1,1,Barcode2,,1,1,"Vendor SKU",08610KUZ-UVLOC-G1,1,1,Aviation,Yes,1,1,Marine,No,1,1,Industrial,No,1,1,Hazardous,Yes,1,1,Special packaging,No,1,1,Ship frozen,No,1,1,Family,,1,1,Lead time,45 business days,1,1,,,,
,simple,HZ08625GUZ-B33-G1,HZ08625GUZ-B33-G1,1,0,visible,"MIL-DLT-53039E TYPE IX FS34031\n\n\n<strong><i>QPL:</i></strong> MIL-DTL-53039 TYPE IV / IX\n\n\n<strong><i>Color specs:</i></strong> GREEN FCS# 34031","MAXIMUM 3.5 VOC VOHAP FREE POLYMERIC BEAD FLATTENED \nNSN NUMBER 8010-01-590-7944\n\n\n<strong><i>QPL:</i></strong> MIL-DTL-53039 TYPE IV / IX\n\n\n<strong><i>Color specs:</i></strong> GREEN FCS# 34031<p><b><i>Notice:</i></b> This is a made-to-order product and has a lead time of 40 business days before it can be shiped.</p><hr />",,,taxable,,1,100,,0,0,23.00,9.00,15.00,9.00,0,,,381.95,"PAINTS > MIL-CARC",,,https://jdlindustries.com/wp-content/uploads/hentzen-mil-gallon-1024.jpg,,,,,,,,,0,fixed,1,"1:381.95,5:354.75,10:327.50",,,Color,,1,1,Weight,23.00,1,1,Manufacturer,HENTZEN,1,1,"Unit of Measure",GAL,1,1,UPC,,1,1,Barcode1,,1,1,Barcode2,,1,1,"Vendor SKU","NSN   8010-01-590-7944",1,1,Aviation,Yes,1,1,Marine,No,1,1,Industrial,No,1,1,Hazardous,Yes,1,1,Special packaging,No,1,1,Ship frozen,No,1,1,Family,"CARC COATINGS",1,1,Lead time,40 business days,1,1,,,,
,simple,HZ08628KUZ-B33-G1,HZ08628KUZ-B33-G1,1,0,visible,"MIL-DLT-53039E TYPE IX FS37038 BLACK\n\n\n<strong><i>QPL:</i></strong> MIL-DLT-53039 TYPE IV / IX\n\n\n<strong><i>Color specs:</i></strong> BLACK FCS# 37038","MAXIMUM 3.5 VOC VOHAP FREE POLYMERIC BEAD FLATTENED \n\n\n<strong><i>QPL:</i></strong> MIL-DLT-53039 TYPE IV / IX\n\n\n<strong><i>Color specs:</i></strong> BLACK FCS# 37038<p><b><i>Notice:</i></b> This is a made-to-order product and has a lead time of 3 business days before it can be shiped.</p><hr />",,,taxable,,1,100,,0,0,23.00,9.00,15.00,9.00,0,,,391.50,"PAINTS > MIL-CARC",,,https://jdlindustries.com/wp-content/uploads/hentzen-mil-gallon-1024.jpg,,,,,,,,,0,fixed,1,"1:391.50,5:363.75,10:335.75",,,Color,,1,1,Weight,23.00,1,1,Manufacturer,HENTZEN,1,1,"Unit of Measure",GALKIT,1,1,UPC,,1,1,Barcode1,"NSN 8010-01-576-2880",1,1,Barcode2,,1,1,"Vendor SKU",08628KUZ-B33-G1,1,1,Aviation,Yes,1,1,Marine,No,1,1,Industrial,No,1,1,Hazardous,Yes,1,1,Special packaging,No,1,1,Ship frozen,No,1,1,Family,,1,1,Lead time,3 business days,1,1,,,,
,simple,HZ08633TUA-B33-G1,HZ08633TUA-B33-G1,1,0,visible,"MIL-DTL-53039 TYPE 1X ISRAELI TAN\n\n\n<strong><i>QPL:</i></strong> MIL-DTL-53039 TYPE IV / IX\n\n\n<strong><i>Color specs:</i></strong> ISRAELI TAN","MAXIMUM 3.5 VOC VOHAP FREE POLYMERIC BEAD FLATTENED \n\n\n<strong><i>QPL:</i></strong> MIL-DTL-53039 TYPE IV / IX\n\n\n<strong><i>Color specs:</i></strong> ISRAELI TAN<p><b><i>Notice:</i></b> This is a made-to-order product and has a lead time of 45 business days before it can be shiped.</p><hr />",,,taxable,,1,100,,0,0,23.00,9.00,15.00,9.00,0,,,362.85,"PAINTS > MIL-CARC",,,https://jdlindustries.com/wp-content/uploads/hentzen-mil-gallon-1024.jpg,,,,,,,,,0,fixed,1,"1:362.85,5:336.95,10:311.05",,,Color,,1,1,Weight,23.00,1,1,Manufacturer,HENTZEN,1,1,"Unit of Measure",KIT,1,1,UPC,,1,1,Barcode1,,1,1,Barcode2,,1,1,"Vendor SKU",08633TUA-B33-01,1,1,Aviation,Yes,1,1,Marine,No,1,1,Industrial,No,1,1,Hazardous,Yes,1,1,Special packaging,No,1,1,Ship frozen,No,1,1,Family,"CARC COLORS",1,1,Lead time,45 business days,1,1,,,,
,simple,"HZ17084GEP-LVOC G2","HZ17084GEP-LVOC G2",1,0,visible,"17084GEP-LVOC Aeroprime Expoxy Primer MEP 10-059 TY II","Aeroprime High Performance Primer is a two part component corrosion and skydrol resistant epoxy primer that is qualified to the MEP 10-059 Type II and exceeds the performance requirements of the BMS10-11 Type I Class A Grade B primer specification.<p><b><i>Notice:</i></b> This is a made-to-order product and has a lead time of 15 business days before it can be shiped.</p><hr />",,,taxable,,1,100,,0,0,23.00,9.00,15.00,9.00,0,,,327.00,"PAINTS > MIL-PRIMERS",,,https://jdlindustries.com/wp-content/uploads/hentzen-mil-gallon-1024.jpg,,,,,,,,,0,fixed,1,"1:327.00,9:295.00,17:266.00",,,Color,,1,1,Weight,23.00,1,1,Manufacturer,HENTZEN,1,1,"Unit of Measure","2-GL KIT",1,1,UPC,,1,1,Barcode1,17084GEP-LVOCKTG,1,1,Barcode2,,1,1,"Vendor SKU",,1,1,Aviation,Yes,1,1,Marine,No,1,1,Industrial,No,1,1,Hazardous,No,1,1,Special packaging,Yes,1,1,Ship frozen,No,1,1,Family,,1,1,Lead time,15 business days,1,1,,,,
,simple,"HZ17292YDF-LVOC KIT","HZ17292YDF-LVOC KIT",1,0,visible,"MIL-PRF-22750 YELLOW  EPOXZEN FED 13538 KIT GL\n\n\n<strong><i>Meets the requirements of:</i></strong> MIL-PRF-22750G TY II CL H GR A","\n\n\n<strong><i>Meets the requirements of:</i></strong> MIL-PRF-22750G TY II CL H GR A",,,taxable,,1,100,,0,0,23.00,9.00,15.00,9.00,0,,,393.50,"HENZ PAINT",,,https://jdlindustries.com/wp-content/uploads/noimage.jpg,,,,,,,,,0,fixed,1,"1:393.50,5:365.50,10:337.50",,,Color,,1,1,Weight,23.00,1,1,Manufacturer,,1,1,"Unit of Measure",KIT,1,1,UPC,17292YDF-LOVC,1,1,Barcode1,,1,1,Barcode2,,1,1,"Vendor SKU",,1,1,Aviation,Yes,1,1,Marine,Yes,1,1,Industrial,Yes,1,1,Hazardous,No,1,1,Special packaging,No,1,1,Ship frozen,No,1,1,Family,,1,1,Lead time,Available from stock,1,1,,,,
,simple,HZ31317BPX-TI,HZ31317BPX-TI,1,0,visible,"35048 FLAT BLUE MIL-PRF-85285 TY I, CL H 3/1 MIX\n\n\n<strong><i>QPL:</i></strong> MIL-PRF-85285 RY 1, CL H","SINGLE COMPONENT BASE ONLY .80 GL\nHZ83395GPX CHROME BLUE  FLAT\n\n\n<strong><i>QPL:</i></strong> MIL-PRF-85285 RY 1, CL H",,,taxable,,1,100,,0,0,23.00,9.00,15.00,9.00,0,,,481.85,"HENZ PAINT",,,https://jdlindustries.com/wp-content/uploads/noimage.jpg,,,,,,,,,0,fixed,1,"1:481.85,5:447.50,10:413.00,50:275.49,100:206.50",,,Color,BLUE,1,1,Weight,23.00,1,1,Manufacturer,HENTZEN,1,1,"Unit of Measure",GL,1,1,UPC,,1,1,Barcode1,,1,1,Barcode2,,1,1,"Vendor SKU",,1,1,Aviation,Yes,1,1,Marine,Yes,1,1,Industrial,Yes,1,1,Hazardous,No,1,1,Special packaging,No,1,1,Ship frozen,No,1,1,Family,,1,1,Lead time,Available from stock,1,1,,,,
,simple,HZ31323CPX-T1,HZ31323CPX-T1,1,0,visible,"CLEAR SEMI-GLOSS MIL-PRF-85285E,TY I, CL H  3/1\n\n\n<strong><i>QPL:</i></strong> MIL-PRF-85285 RY 1, CL H","\n\n\n<strong><i>QPL:</i></strong> MIL-PRF-85285 RY 1, CL H",,,taxable,,1,100,,0,0,23.00,9.00,15.00,9.00,0,,,393.50,"HENZ PAINT",,,https://jdlindustries.com/wp-content/uploads/hentzen-mil-gallon-1024.jpg,,,,,,,,,0,fixed,1,"1:393.50,5:365.50,10:337.50,50:225.00,100:168.65",,,Color,CLEAR,1,1,Weight,23.00,1,1,Manufacturer,HENTZEN,1,1,"Unit of Measure",GGL.80,1,1,UPC,,1,1,Barcode1,,1,1,Barcode2,,1,1,"Vendor SKU","HZ31323CPX-T1 NOTINT",1,1,Aviation,Yes,1,1,Marine,Yes,1,1,Industrial,Yes,1,1,Hazardous,No,1,1,Special packaging,No,1,1,Ship frozen,No,1,1,Family,PAINT,1,1,Lead time,Available from stock,1,1,,,,
,simple,HZ31360WPX-T1,HZ31360WPX-T1,1,0,visible,"27925 SEMI GLOSS WHITE MIL-PRF-85285 TY I, CL H 3/1 MI\n\n\n<strong><i>QPL:</i></strong> MIL-PRF-85285 TY 1, CL H","SINGLE COMPONENT BASE ONLY .80 GL\nHZ83395GPX CHROME  WHITE \n\n\n<strong><i>QPL:</i></strong> MIL-PRF-85285 TY 1, CL H",,,taxable,,1,100,,0,0,23.00,9.00,15.00,9.00,0,,,393.50,"HENZ PAINT",,,https://jdlindustries.com/wp-content/uploads/noimage.jpg,,,,,,,,,0,fixed,1,"1:393.50,5:365.50,10:337.50,50:225.00,100:168.65",,,Color,WHITE,1,1,Weight,23.00,1,1,Manufacturer,HENTZEN,1,1,"Unit of Measure",GL,1,1,UPC,,1,1,Barcode1,,1,1,Barcode2,,1,1,"Vendor SKU",,1,1,Aviation,Yes,1,1,Marine,Yes,1,1,Industrial,Yes,1,1,Hazardous,No,1,1,Special packaging,No,1,1,Ship frozen,No,1,1,Family,,1,1,Lead time,Available from stock,1,1,,,,
,simple,HZ35620APX-TI,HZ35620APX-TI,1,0,visible,"36375 GRAY FLAT MIL-PRF-85285E,TY I &amp; IV , CL H  3/1 M","MIL-PRF-85285E, TYPE I &amp; IV, CLASS H - ONE GALLON KIT .75 GL BASE TO ONE QUART CATALYST 35502CMU MAKES ONE GALLON\nPOLYURETHANE, HIGH SOLIDS, 2.8 VOC, AIRCRAFT APPLICATION.\nPAINT IS TO BE APPLIED OVER APPROVED MIL-PRF-23377 OR MIL-PRF-85582 PRIMERS TO 0.60 - .09 MILLS DF",,,taxable,,1,100,,0,0,23.00,9.00,15.00,9.00,0,,,393.50,"HENZ PAINT",,,https://jdlindustries.com/wp-content/uploads/noimage.jpg,,,,,,,,,0,fixed,1,"1:393.50,5:365.50,10:337.50,50:225.00,100:168.65",,,Color,GRAY,1,1,Weight,23.00,1,1,Manufacturer,,1,1,"Unit of Measure","1-GL KIT",1,1,UPC,,1,1,Barcode1,,1,1,Barcode2,,1,1,"Vendor SKU",,1,1,Aviation,Yes,1,1,Marine,Yes,1,1,Industrial,Yes,1,1,Hazardous,No,1,1,Special packaging,No,1,1,Ship frozen,No,1,1,Family,PAINT,1,1,Lead time,Available from stock,1,1,,,,
,simple,HZ35631APX-35502CMU,HZ35631APX-35502CMU,1,0,visible,"36270 MIL-PRF-85285 TY I &amp; IV CL H, FMS-1027 GALKIT\n\n\n<strong><i>QPL:</i></strong> FMS 1027 TYPE V; MIL-PRF-85285 TYPE I CLASS H; MIL-PRF-85285 TYPE IV CLASS H","\n\n\n<strong><i>QPL:</i></strong> FMS 1027 TYPE V; MIL-PRF-85285 TYPE I CLASS H; MIL-PRF-85285 TYPE IV CLASS H",,,taxable,,1,100,,0,0,23.00,9.00,15.00,9.00,0,,,511.75,PAINTS,,,https://jdlindustries.com/wp-content/uploads/noimage.jpg,,,,,,,,,0,fixed,1,"1:511.75,5:447.95,10:383.85",,,Color,GRAY,1,1,Weight,23.00,1,1,Manufacturer,HENTZEN,1,1,"Unit of Measure","1-GL KIT",1,1,UPC,,1,1,Barcode1,,1,1,Barcode2,,1,1,"Vendor SKU",35631APX/35502CMU,1,1,Aviation,Yes,1,1,Marine,Yes,1,1,Industrial,Yes,1,1,Hazardous,No,1,1,Special packaging,No,1,1,Ship frozen,No,1,1,Family,TOPCOAT,1,1,Lead time,Available from stock,1,1,,,,
,simple,HZ53039WPX,HZ53039WPX,1,0,visible,"FAST DRYING URETHANE PRIMER SURFACE MEP 10-070 GK-1\n\n\n<strong><i>Meets the requirements of:</i></strong> MEP 10-070\n\n\n<strong><i>Color specs:</i></strong> WHITE","53039WPX IS A HIGH PERFORMANCE SPRAYABLE SURFACER MEP 10-070 PRIMER 3:1 VOLUME\n\n\n<strong><i>Meets the requirements of:</i></strong> MEP 10-070\n\n\n<strong><i>Color specs:</i></strong> WHITE",,,taxable,,1,100,,0,0,23.00,9.00,15.00,9.00,0,,,542.00,"PAINTS > MIL-PRIMERS",,,https://jdlindustries.com/wp-content/uploads/hentzen-mil-gallon-1024.jpg,,,,,,,,,0,fixed,1,"5:542.00",,,Color,WHITE,1,1,Weight,23.00,1,1,Manufacturer,HENTZEN,1,1,"Unit of Measure",GALKIT,1,1,UPC,,1,1,Barcode1,,1,1,Barcode2,,1,1,"Vendor SKU","53039WPX - 53021CMU",1,1,Aviation,Yes,1,1,Marine,No,1,1,Industrial,No,1,1,Hazardous,No,1,1,Special packaging,Yes,1,1,Ship frozen,No,1,1,Family,PRIMER,1,1,Lead time,Available from stock,1,1,,,,
,simple,"HZK02110GVP  KIT-2GL","HZK02110GVP  KIT-2GL",1,0,visible,"02110GVP WASH PRIMER PRETREATMENT GREEN 2GL/KT\n\n\n<strong><i>QPL:</i></strong> DOD-P15328D\n\n\n<strong><i>Color specs:</i></strong> GREEN","PRIMER ( WASH )PRETREATMENT (Formula # 117 for Metals ) Color GREEN 2GL/KT\nDEFENSE PRIMERS\n\n\n<strong><i>QPL:</i></strong> DOD-P15328D\n\n\n<strong><i>Color specs:</i></strong> GREEN<p><b><i>Notice:</i></b> This is a made-to-order product and has a lead time of 30 business days before it can be shiped.</p><hr />",,,taxable,,1,4,,0,0,23.00,9.00,15.00,9.00,0,,,352.85,"PAINTS > MIL-PRIMERS",,,https://jdlindustries.com/wp-content/uploads/hentzen-mil-gallon-1024.jpg,,,,,,,,,0,fixed,1,"1:352.85,5:323.50,10:294.15,50:236.25,100:176.45",,,Color,GREEN,1,1,Weight,23.00,1,1,Manufacturer,HENTZEN,1,1,"Unit of Measure","2-GL KIT",1,1,UPC,,1,1,Barcode1,8030-00-281-2726,1,1,Barcode2,,1,1,"Vendor SKU","02110VVP / 02111SSC",1,1,Aviation,Yes,1,1,Marine,No,1,1,Industrial,No,1,1,Hazardous,Yes,1,1,Special packaging,No,1,1,Ship frozen,No,1,1,Family,PRIMER,1,1,Lead time,30 business days,1,1,,,,
,simple,HZK16708TEP_G,HZK16708TEP_G,1,0,visible,"MIL-PRF-23377K TYPE I CLASS N EPOXY PRIMER 3/1\n\n\n<strong><i>QPL:</i></strong> LMCO EMAP, C-130 PROPELLERS; LMCO FQML-P-23377-7; MIL-PRF-23377K, TYPE II, CLASS N\n\n\n<strong><i>Color specs:</i></strong> TAN","MIL-PRF-23377K TYPE II CLASS N EPOXY PRIMER 3/1  COLOR TAN 3/1 CATALYST 16709CEH\nNON-CHROME AERO EPOXY PRIMER\n\n\n<strong><i>QPL:</i></strong> LMCO EMAP, C-130 PROPELLERS; LMCO FQML-P-23377-7; MIL-PRF-23377K, TYPE II, CLASS N\n\n\n<strong><i>Color specs:</i></strong> TAN<p><b><i>Notice:</i></b> This is a made-to-order product and has a lead time of 90 business days before it can be shiped.</p><hr />",,,taxable,,1,6,,0,0,23.00,9.00,15.00,9.00,0,,,651.00,"PAINTS > MIL-PRIMERS",,,https://jdlindustries.com/wp-content/uploads/hentzen-mil-gallon-1024.jpg,,,,,,,,,0,fixed,1,"1:650.99,5:610.30,10:570.00,50:488.25,100:406.85",,,Color,TAN,1,1,Weight,23.00,1,1,Manufacturer,HENTZEN,1,1,"Unit of Measure","1-GL KIT",1,1,UPC,,1,1,Barcode1,,1,1,Barcode2,,1,1,"Vendor SKU","16708TEP / 16709CEH",1,1,Aviation,Yes,1,1,Marine,No,1,1,Industrial,No,1,1,Hazardous,Yes,1,1,Special packaging,Yes,1,1,Ship frozen,No,1,1,Family,PRIMER,1,1,Lead time,90 business days,1,1,,,,
,simple,"HZK17084GEP KIT-2GL","HZK17084GEP KIT-2GL",1,0,visible,"17084GEP-LVOC/ 17085 CEH/ BAC 452 GRN EPOXY PRIMER-2GL","BMS10-11, TY-1 (B)\nMEP 10-059, TY-II<p><b><i>Notice:</i></b> This is a made-to-order product and has a lead time of 15 business days before it can be shiped.</p><hr />",,,taxable,,1,100,,0,0,23.00,9.00,15.00,9.00,0,,,327.00,"PAINTS > MIL-PRIMERS",,,https://jdlindustries.com/wp-content/uploads/hentzen-mil-gallon-1024.jpg,,,,,,,,,0,fixed,1,"1:327.00,9:295.00,17:266.00,31:220.62",,,Color,GREEN,1,1,Weight,23.00,1,1,Manufacturer,HENTZEN,1,1,"Unit of Measure","2-GL KIT",1,1,UPC,,1,1,Barcode1,,1,1,Barcode2,,1,1,"Vendor SKU","HXK17084GEP KIT-2GL",1,1,Aviation,Yes,1,1,Marine,No,1,1,Industrial,No,1,1,Hazardous,No,1,1,Special packaging,Yes,1,1,Ship frozen,No,1,1,Family,PRIMER,1,1,Lead time,15 business days,1,1,,,,
,simple,HZK17176KEP_G,HZK17176KEP_G,1,0,visible,"MIL-PRF-23377, TY II,CL N  DARK GREEN PRIMER 3/1 GLKIT\n\n\n<strong><i>QPL:</i></strong> MIL-PRF-23377K, TYPE II, CLASS N\n\n\n<strong><i>Color specs:</i></strong> LOW IR DARK GREEN","Dark Green Hentzen's Aerospace High Performance Primer 17176KEP/16709CEH, Chromate-Free.  This Epoxy Primer has been formulate to have excellent corrosion resistance and meet all the performance requirements of the specification.\n\n\n\n\n<strong><i>QPL:</i></strong> MIL-PRF-23377K, TYPE II, CLASS N\n\n\n<strong><i>Color specs:</i></strong> LOW IR DARK GREEN<p><b><i>Notice:</i></b> This is a made-to-order product and has a lead time of 90 business days before it can be shiped.</p><hr />",,,taxable,,1,2,,0,0,23.00,9.00,15.00,9.00,0,,,673.45,"PAINTS > MIL-PRIMERS",,,https://jdlindustries.com/wp-content/uploads/hentzen-mil-gallon-1024.jpg,,,,,,,,,0,fixed,1,"1:673.45,5:631.50,10:589.25,50:505.05,100:420.95",,,Color,"DARK GREEN",1,1,Weight,23.00,1,1,Manufacturer,HENTZEN,1,1,"Unit of Measure","1-GL KIT",1,1,UPC,,1,1,Barcode1,,1,1,Barcode2,,1,1,"Vendor SKU","17176KEP - 16709CEH",1,1,Aviation,Yes,1,1,Marine,No,1,1,Industrial,No,1,1,Hazardous,Yes,1,1,Special packaging,Yes,1,1,Ship frozen,No,1,1,Family,PRIMER,1,1,Lead time,90 business days,1,1,,,,
,simple,HZK2110GVP_2G,HZK2110GVP_2G,1,0,visible,"TWO COMPONENT WASH PRIMER FORM. 117 DOD-P-15328 GAL\n\n\n<strong><i>QPL:</i></strong> DOD-P-15328D","\n\n\n<strong><i>QPL:</i></strong> DOD-P-15328D",,,taxable,,1,100,,0,0,23.00,9.00,15.00,9.00,0,,,352.80,"PAINTS > MIL-PRIMERS",,,https://jdlindustries.com/wp-content/uploads/hentzen-mil-gallon-1024.jpg,,,,,,,,,0,fixed,1,"1:352.80,5:323.50,10:294.15,50:236.25,100:176.45",,,Color,,1,1,Weight,23.00,1,1,Manufacturer,HENTZEN,1,1,"Unit of Measure",GALKIT,1,1,UPC,,1,1,Barcode1,,1,1,Barcode2,,1,1,"Vendor SKU",2110GVP_2G,1,1,Aviation,Yes,1,1,Marine,No,1,1,Industrial,No,1,1,Hazardous,No,1,1,Special packaging,Yes,1,1,Ship frozen,No,1,1,Family,,1,1,Lead time,Available from stock,1,1,,,,
